"Outdoor Research","Transcendent Down Sweater - Men's","108666816",5,"This is a straightforward, well-made down jacket.  It has lofty 650 fill down, but not a ton of it. It is roomy, not a trim fit, so layering over a fleece or softshell in cold conditions is not a problem. Colors and fabric finish are nice. I'm happy with it. It does not have a DWR finish, so a shell over top would be a must in wet conditions.","NOT_EMPLOYEE","2016-12-15 00:00:00","I've used it once or twice and have initial impressions",""
"Outdoor Research","Transcendent Down Sweater - Men's","5519241",2,"Returned this jacket because the sleeves were too wide and long, and not filled with down near the cuffs.","NOT_EMPLOYEE","2016-07-02 00:00:00","",""
"Outdoor Research","Transcendent Down Sweater - Men's","632318574",5,"I have used this jacket hiking, skiing, backpacking, and just basic car camping.   I bought this jacket when I was about 230-240 lbs and it fit great.  I have lost some weight so it runs big for me now.  I would go with the size large for my current specs.  Any questions let me know! ","NOT_EMPLOYEE","2016-05-31 00:00:00","I've put it through the wringer",""
"Outdoor Research","Transcendent Down Sweater - Men's","107205246",5,"If looking for a slim athletic look and are around my size, suggest going with the Medium over the Large. The warmth and look are great and the color is true to display.","NOT_EMPLOYEE","2016-01-18 00:00:00","I returned this product before using it",""
"Outdoor Research","Transcendent Down Sweater - Men's","4962981",4,"Definitely would recommend this jacket for anyone who is looking for a lightweight jacket that keeps you warm.  Can fit under a shell with ease.  Has a nice fit to it.","NOT_EMPLOYEE","2016-01-07 00:00:00","",""
"Outdoor Research","Transcendent Down Sweater - Men's","1512979748",3,"This jacket has all the right features.  The pockets and neck are lined with soft material, that make the jacket feel warmer.  The problem for me was fit.  Looking at the size chart I thought I was between a Small and a Medium (5'8, 155), so I ordered both.  Small was a better fit, but the sleeves felt baggy in the forearms, and just big in the upper arms.  I am not a body builder, but I am in pretty good shape.  The fit was off enough that I am returning the jacket.  There are so many of this type of jacket on the market, now.  I read a bunch of reviews of different brands, and every one has some complaints about fit.  Of course they all also have a lot of positive reviews for the fit.  It probably makes sense to just keep looking until you find the one that fits you best","NOT_EMPLOYEE","2015-12-30 00:00:00","I returned this product before using it",""
"Outdoor Research","Transcendent Down Sweater - Men's","106848368",5,"Spent a lot of time looking for a lightweight insulated jacket like this. Looked at a lot of Patagonia/north face/ etc. This was definitely the jacket to buy, very satisfied with my purchase. It's super lightweight and very warm, and less expensive than other jackets in its class. Stuffs down into the right pocket really easily. If you are looking for a good down jacket get this one!!! You will not be disappointed.","NOT_EMPLOYEE","2015-12-21 00:00:00","",""
"Outdoor Research","Transcendent Down Sweater - Men's","2450818",5,"I've used this OR jacket in Southern California for the last week or so, night temps ranging from 45-50F including an evening boat traverse over the ocean and it does a solid job of keeping my core warm. It's interesting to notice my legs feeling cold in wind and yet my chest actually feeling very toasty. This jacket is distinctly warmer than an REI Windbrake fleece and much lighter. I don't know how it performs in heavy heavy winds or deep cold.

The good:
- Warm core - Down fill is pretty good and stuffs nicely, but the arms are not nearly as warm as the chest.
- Fit / Aesthetics - well-fitted, great waist cinch, and nice color. (Dusk/Night)
- Fleece pocket liner
- Great value -  a durable, warm, dry-weather down jacket.
- Stuffs into its own pocket 


The not as awesome:
- No DWR / no Hydrophobic Down - Limits this jacket to arid climate ventures. (Understandable for the price point)
- Mine seems to consistently leak a bit of down. Almost every time I wear it, I notice little while strands fluffing out of the outside seams on the arms/shoulders. Will update after a few weeks have passed to see if this is still happening...","NOT_EMPLOYEE","2015-12-20 00:00:00","I've used it several times",""
"Outdoor Research","Transcendent Down Sweater - Men's","106619079",5,"This jacket is very light weight and very warm. It packs down to a very compact size in the attached stuff sack. I would recommend this to anyone looking for a good down jacket. For me the medium size fits well and leaves some room for a few layers underneath if need be.","NOT_EMPLOYEE","2015-12-18 00:00:00","I've put it through the wringer",""
"Outdoor Research","Transcendent Down Sweater - Men's","106867332",4,"Ordered this jacket and received it lickity-split.  Appreciate fast shipping.  The jacket is extremely light.  You can feel warmth immediately once on.  I am 5'9"", 150# and it fits me perfectly.  The jacket is toasty in a cold car (it was 24 degrees in northern Minnesota this morning) but once outside needs to be paired with another layer.  Breeze gets through the coat.  I do not think the jacket justifies a $200 price tag, but getting it on sale at a third off is more in-line.   It is a very comfortable jacket and fits well.  ","NOT_EMPLOYEE","2015-12-03 00:00:00","I've used it once or twice and have initial impressions",""
"Outdoor Research","Transcendent Down Sweater - Men's","106625195",5,"Great jacket. More form fitting than most jackets, meaning it warms up quicker and stays that way. The design of the pockets is fantastic; roomy, yet nearly invisible. The collar is great because it doesn't stick up in your face like most down jackets. Very comfortable, very warm, and hands down best jacket I've ever owned.","NOT_EMPLOYEE","2015-11-04 00:00:00","I've used it several times",""
"Outdoor Research","Cirque Softshell Pants - Women's","105827760",5,"Great fit!  Nice side pocket.  Using for winter hiking.","NOT_EMPLOYEE","2017-12-06 00:00:00","I've used it several times",""
"Outdoor Research","Cirque Softshell Pants - Women's","109141989",4,"These pants are awesome. They are warm, breathable, versatile, and resistant to water. BUT I wish they came in more sizes. I usually wear a size 6, but the medium is too loose with too long of legs and the small is too tight. Very aggravating. If this came in specific sizes (2, 4, 6, etc.), I would have given it 5 stars. *sigh*","NOT_EMPLOYEE","2017-05-22 00:00:00","I've used it several times",""
"Outdoor Research","Cirque Softshell Pants - Women's","106090545",5,"I love these pants! They are super stretchy, comfortable, and durable and you can wear them for long days in the mountains! I wore them for a weeklong alpine climbing trip and they didn't disappoint! I also wear them for winter or cold hiking, as well as skinning. If you are looking for a great winter/spring hiking pant, look no further! ","NOT_EMPLOYEE","2017-03-08 00:00:00","I've put it through the wringer",""
"Outdoor Research","Cirque Softshell Pants - Women's","3174787",4,"I love these pants. Got them for backcountry and uphill skinning. Great when you are moving but cold when stopped (as expected). I also run cold. My boyfriend has the same ones in the mens and he loves them. Also good for XC skiing too. I love the tabs on the sides which allow the correct fitting around my waist. I often have the problem in womens outdoor gear with bad sizing for athletic women. This feature solves that issue. 
I am 5","NOT_EMPLOYEE","2017-01-31 00:00:00","I've used it several times",""
"Outdoor Research","Cirque Softshell Pants - Women's","2780774",3,"These are great pants, but the sizing is off. Based on reviews I ordered the medium. I'm 5'5', 128 lbs and athletic. The medium was huge even with my thermal weight tights on underneath. So, I ordered the small. They fit trim like pants with little room in the waist to comfortable wear any weight thermal. How there is such a size discrepancy between the two sizes is baffling to me.  I generally wear a size 4 and am confused why neither of these fit.  So, back they both go. ","NOT_EMPLOYEE","2017-01-20 00:00:00","I returned this product before using it",""
"Outdoor Research","Cirque Softshell Pants - Women's","107542818",5,"I ordered these pants for winter training in prep for an alpine expedition this summer.  I had them with me for a mountain hike in the snow and they kept me toasty warm and dry.  Our next stop on the same trip was the CA central coast.  I wore them on a 55 degree day hike and they were so breathable that I didn't overheat.  I'm 5'3, 117 lbs with a small waist.  I have trouble finding pants that fit my behind and thighs without gapping at the waist.  The adjustable waist tabs on these pants provided a perfect fit in size small.  ","NOT_EMPLOYEE","2017-01-03 00:00:00","I've used it several times",""
"Outdoor Research","Cirque Softshell Pants - Women's","107881208",4,"I'm 5'5' 135lb and usually wear medium. So I ordered medium and it's perfect. Very comfortable and gives me a good range of motion. There's enough room for one thick layer for me.  Not waterproof but it kept me dry when I used for snowshoeing.   ","NOT_EMPLOYEE","2016-12-17 00:00:00","",""
"Outdoor Research","Cirque Softshell Pants - Women's","4842571",4,"Amazing fit for a curvy figure, sits high enough on my waist to feel secure & comfortable. my only complaint is the stiffness of the bottom of the leg, but I think that will be a non-issue with hiking /snow boots on. Super well-made, definitely quality for the price. I'm 5'2","NOT_EMPLOYEE","2016-11-29 00:00:00","I've used it once or twice and have initial impressions",""
"Outdoor Research","Cirque Softshell Pants - Women's","105999286",4,"I bought these as a gift for my girlfriend. I have the mens version and I think they are the best soft shell pants around.  She ordered the xs (her usual size) and ended up returning them for a s so that she could fit base layers underneath. ","NOT_EMPLOYEE","2016-11-17 00:00:00","",""
"Outdoor Research","Cirque Softshell Pants - Women's","1829560079",5,"I ordered XS and S for my upcoming Mt. Rainier climb. Size XS was way too small but the S fit perfectly (I am 5'7"" and weight about 135lb. The pants are fantastic, they are warm and very durable . I plan on taking them with me to climb Mt. Denali next year. ","NOT_EMPLOYEE","2016-07-18 00:00:00","I've put it through the wringer",""
"Outdoor Research","Cirque Softshell Pants - Women's","2020179173",5,"I have used these snowshoeing and absolutely love them. I did wear a heavy base layer for warmth. These pants are very comfortable with the stretch fabric. The adjustable waistband is great. While they are not completely waterproof, they are resistant enough to have kept me dry. Highly recommend.","NOT_EMPLOYEE","2016-02-09 00:00:00","",""
"Outdoor Research","Cirque Softshell Pants - Women's","1150818655",4,"I love these pants. They have held up to three years of dog sledding abuse. The pants have sustained a few holes in the fabric over time but considering that they have been exposed to millions of sharp dog nails, real nails and snow hooks I am impressed. The holes also do not grow over time which is great as well. They are more waterproof than many of my rain pants and dry much faster. The only negative comment I have towards these pants is the zipper fly. It splits at the bottom and is always coming open even with the zipper is fully up. I have had the zipper replaced once with a heavier zipper and the same problem arises.  My boyfriend also ownes these pants and has the same problem so I know it's not just me and my pair. Other than the zipper issues I practically live in these pants all year long. ","NOT_EMPLOYEE","2015-09-28 00:00:00","",""
"Outdoor Research","Cirque Softshell Pants - Women's","1224938","","Circque pants kept me warm for 12 days in the Alaska Range","NOT_EMPLOYEE","2015-05-11 00:00:00","",""
"Outdoor Research","Cirque Softshell Pants - Women's","1224938",4,"as a paradoxical outdoorsy girl and skinny jeans-wearer, i'm always on a quest to find pants that perform well and are flattering/slim fit. these are a pretty good match. i wear these in an xs, but if i wanted a more relaxed fit, the s would probably work well. i'm perfectly comfortable in the xs, but wouldn't be able to fit a very thick baselayer underneath. they are perfect for snow days with my icebreaker midweight base layer. 
for my wildnerness first responder class, i had to lay in the snow for an extended period of time as a ""patient."" these kept me warm and dry, even while laying sedentary in fresh snow. 
the bottom of the pant is slightly tight around my snowboard boots, but the zippers make them easy to get on. i docked one star because i did have a zipper fail on my first pair and had to exchange them. ","NOT_EMPLOYEE","2015-02-24 00:00:00","I've used it several times",""
"Outdoor Research","Cirque Softshell Pants - Women's","3187063",3,"So I decided to try ice climbing...yikes! On the recommendation of the San Juan Mountain Guides, after registering for an Intro clinic at the Ouray Ice Festival, I ordered these with 2-day shipping (nothing like last-minute purchases, great planning, yeah, yeah) and excitedly tore open the bag when they arrived. Stepped into these super-cool, wonderfully stretchy pants, hiked them up and...what the what?! These things are crAzy-long! I'm 5'7"", so what's going on here? I check the tag - ""Did I accidentally order a Tall?"" - no, I did not. But what do I know from ice climbing pants. Mayyyybe when I get the demo boots and crampons on, they'll be fine, hmm. Nope. They bunched around my lower legs and ankles. Can you GUESS what happened? That's right, my crampon punched a little hole ABOVE the protective patch on the inside leg. Aarrgh! Was it still awesome? Heck, yes! But my boyfriend tried these pants on later and they FIT him. He's 6'2"", for cryin' out loud! He's got his own pants, so he won't be rocking these babies anywhere anytime soon. Has anyone else found these pants to be ridiculously long? On a side note: nice goat on my helmet!","NOT_EMPLOYEE","2015-02-14 00:00:00","I've used it once or twice and have initial impressions",""
"Outdoor Research","Cirque Softshell Pants - Women's","1298019027",5,"Bought these for hiking ice climbing and backcountry skiing.  They have been awesome for all of these things!  They have areas of stretchier fabric in the crotch and above the butt so you can move easy and still be comfortable.   Have held up well against rock and ice, only wear was from a wayward high crampon step. ","NOT_EMPLOYEE","2015-01-30 00:00:00","I've put it through the wringer",""
"Outdoor Research","Cirque Softshell Pants - Women's","2146828",5,"I bought these to use as winter hiking and climbing pants. I was worried that using a softshell wouldn't be windproof/waterproof enough but these are perfect! They are really stretchy and don't hinder movement at all. I wore them in -10 degree temps with 30mph wind with smartwool base and fleece pant midlayer and was comfortable (the next day I forwent the midlayer and was uncomfortably cold) They do run a little big--I typically wear size 6 in pants and ordered a medium and they are a bit baggy. I was originally going to return them but knew that I would want two layers underneath for some upcoming colder climbs and I'm really glad I stayed with the medium. The waist has nifty velcro straps that you can cinch down which negates the need for a belt. I also really like the pocket placement lower on the right leg so that items are easily accessible when wearing a harness. It's obvious that these pants are designed to function well. ","NOT_EMPLOYEE","2015-01-16 00:00:00","I've used it several times",""
"Outdoor Research","Cirque Softshell Pants - Women's","6215801",5,"Loved them the moment i put them on.. Great even for a skinny guy. Stretchable fabric is really good for climbing and hiking. Very breathable .. All Thumbs up","NOT_EMPLOYEE","2015-01-08 00:00:00","I've used it once or twice and have initial impressions",""
"Outdoor Research","Cirque Softshell Pants - Women's","2920977",5,"Just came back from a Canada/Northern Minnesota ice climbing trip and these pants held up like nothing I've had in the past. They have a great fit with kick patches and ergonomic knees. They don't sag and the Velcro waist adjustment was sufficient with out having to use the belt loops. I originally ordered the large (based on the size chart) and they were WAY too big, so returned them for a medium and those fit like a glove.  The cuffs don't touch the ground but they also don't come ridding up when high-stepping or kicking. Also when wading through waist-high Canada snow none of it actually invaded my pant legs (even with out gaiters on)
I could get a mid weight wool base layer under these pants just fine.  Ladies, please buy these pants!","NOT_EMPLOYEE","2014-03-02 00:00:00","I've used it several times",""
"Outdoor Research","Ferrosi Pant - Men's","1960055",4,"Really like these pants, feels like a silky and barely noticeable layer of protection. The stretch in the material is awesome and they move with you where ever you go with zero restriction. I got my pants a little too long, that is my bad.  Even with the adjustable ankle gusset I still catch them walking pretty frequently.  Wore these pants in single degree temps with a pair of long johns and they did great.  The windproof really shines when the weather turns nasty.  I also wore them in 80+ temps and they performed equally well.  My only gripe is that after wearing these for some time the material is starting to pile around the pockets and front belt loops.  The pants also stain pretty easy to food, oil, booze etc.  Light weight, you will never know they are there but a bit fragile. ","NOT_EMPLOYEE","2017-11-27 00:00:00","I've put it through the wringer",""
"Outdoor Research","Ferrosi Pant - Men's","108452203",5,"Comfortable, stretchy, lightweight. These are great camp pants for warm weather. I like the zippered back and thigh pockets. The cinch cord at the ankle tucks away nicely so it doesn't flop around. 

I wear a 33/30 in pants and got these in a 34/short for a loose fit. 

","EMPLOYEE","2017-11-20 00:00:00","I've used it several times","true"
"Outdoor Research","Ferrosi Pant - Men's","109634242",5,"I've used these pants for a variety of fall weather activity...from canyoneering in Moab, to rock climbing in eastern Washington to hiking in the Cascades. They are durable, stretch great, and do what a great pair of outdoors pants should...","NOT_EMPLOYEE","2017-11-12 00:00:00","I've put it through the wringer",""
"Outdoor Research","Ferrosi Pant - Men's","105325875",5,"These pants are the best, lightweight and comfy.  They run large,  I usually wear 35/36"" waist pants and the 34 fits fine.  ","NOT_EMPLOYEE","2017-11-08 00:00:00","I've put it through the wringer",""
"Outdoor Research","Ferrosi Pant - Men's","106530975",4,"Great 3-season pants.  I purchase the 34/30s which were a little loose in midsection, so you need a belt, but perfect through legs.  There pants are very light so you need to layer for colder temperatures.  They are perfect for warmer days.  Also the material is fairly delicate / burns easily.  I was sitting by a campfire and a small ember/spark floated onto my pants.   It burned a hole right through them before I could brush it off.  I doubt this would've happened with a tougher fabric like denim.  ","NOT_EMPLOYEE","2017-10-23 00:00:00","I've put it through the wringer",""
"Outdoor Research","Ferrosi Pant - Men's","110199637",5,"Outdoor research is known for making quality and thoughtful products, and these pants are no different. I wear them on cool weather hikes, as well as casually.  The material is VERY breathable and comfortable. The trade off here is wind resistance. If you are expecting to wear these in a cold weather hiking situation, you can be iced out on a windy summit. Keeping those limitations in mind, these pants rock for fall hiking or climbing, and have been very durable for me thus far. The fit is slimming but not tight. The waist measurements are definitely true to size though, if not a touch large. I have purchased a second pair because these are so comfortable to wear every day as a casual pant.","EMPLOYEE","2017-10-20 00:00:00","I've put it through the wringer",""
"Outdoor Research","Ferrosi Pant - Men's","3015839",4,"I am 5'8'' with a 32 inch waist. I purchased the Ferrosi pants in a size 32/reg. The quality of the pants are nice. I really liked them, I just wish they would fit with a little more room. The material is thin and appropriate for hot weather. Unfortunately for me, the pants are a little too tight and the material is a little on the thin side that I can't wear these with out showing the world a perfect outline of my stuff. The pants fit tight through my quads and my butt. Everywhere else they fit fine","NOT_EMPLOYEE","2017-08-19 00:00:00","I've used it once or twice and have initial impressions",""
"Outdoor Research","Ferrosi Pant - Men's","108580249",4,"I loved these pants. They look great with 5.10 Pinks La Sportiva Trangos AND camo Crocs. Plus, my girlfriend loved the way they showed off my ""best assets."" 

Recently purchased for my annual pilgrimage west, they performed well in the mountains: alpine climbs, long glissades, all day trad-ventures, backpacking guiding, and post-climb beer and burger binging (stretchy waistline!). 

But after returning to the southeast, I climbed one chimney pitch and when I reached the belay I noticed a sizeable hole in the crotch. My beloved pants were now R-rated. Maybe they're not meant for southern sandstone. Or chimneys. 

OR has been wonderful and is exchanging them but, for now, my regional allegiance is to Carharrt. ","NOT_EMPLOYEE","2017-07-20 00:00:00","I've put it through the wringer",""
"Outdoor Research","Ferrosi Pant - Men's","109913303",5,"These are one of the most comfortable pair of pants I have ever worn.  They look great too.  I haven't worn them in the wild yet, but I imagine they'll be great. They are lightweight with enough stretch to do every outdoor activity imaginable. I dont expect to overheat in these. I would highly recommend.","NOT_EMPLOYEE","2017-07-19 00:00:00","",""
"Outdoor Research","Ferrosi Pant - Men's","106651631",5,"I'm absolutely amazed with how well these pants have held up.  They're my go to for anything outdoors be it hiking, climbing, kayaking, or bike rides. They're a fantastic light material perfect for warm weather outings. Paired with an insulating baselayer they made a great shell for hiking the Adirondack high peaks in winter. They're stretchy enough for any bouldering problem, they dry quickly if you get caught in a quick shower, and despite constant beatings they refuse to tear. I can't say enough good about these pants!","NOT_EMPLOYEE","2017-07-08 00:00:00","I've put it through the wringer",""
"Outdoor Research","Ferrosi Pant - Men's","106646732",5,"Seriously, these pants are so awesome. They are super comfortable, fit great, and look good. They are perfect for hiking or climbing, lightweight, breathable, and when conditions arent so nice, they give a little protection. I consistently get compliments on them when I wear them more casually too. And last but not least, these have become my new pants for traveling. Now, I just need another pair.","NOT_EMPLOYEE","2017-06-21 00:00:00","I've put it through the wringer",""
"Outdoor Research","Ferrosi Pant - Men's","5004869",5,"First: Sizing... Before ordering these I spent a lot of time trying to figure out what size to purchase. I am a 34 waist in every pair of OR pants I own, but these seemed to have mixed reviews. Some say they are huge and to size down, some say they are right on the money. I am here to tell you that they fit exactly as advertised. The 34 waist fits perfectly on me. I ordered the 32 waist just for comparison and while I could get them on I'm not sure ""hot pants"" are a flattering look on me. So if you are trying to figure out what size to get I suggest go with your usual size.

Function: I was immediately surprised at how light these pants are. I have had other soft shell style pants but these blow them out of the water as far as weight. I could probably wear them on the hottest most humid summer day and have no discomfort. They fit nice as well and I could get away wearing them in a professional environment with one of my sweet OR button down tops. Pockets in all the right places, and the zippered leg pocket is big enough for my phone and optimally placed back on the leg to not be cumbersome when hiking or scrambling. 
I can see these being my go-to summer pants. 

Another great product!

Now if they can just offer more colors in the short inseam!","NOT_EMPLOYEE","2017-05-31 00:00:00","I've used it once or twice and have initial impressions",""
"Outdoor Research","Ferrosi Pant - Men's","109542086",4,"I've got thighs like fully grown Coastal Redwood trees and these pants definitely fit a little snug. Thank goodness for the stretch which is phenomenal. I can throw heels without worrying about gaining plumber status. They definitely are thinner than I had expected but I guess that's to be expected whenever a product is ""breathable."" I'd be really happy if OR made the front hand pockets a little deeper.","EMPLOYEE","2017-05-06 00:00:00","I've used it several times",""
