"Outdoor Research","Solar Roller Sun Hat - Women's","2235509",5,"I purchased this for teaching surf lessons and small surf days.  It stays on well and helps keep the sun out of my eyes.  I wouldn't wear it on larger days for fear that it would get ripped off my head, but it's fine most days in Florida.  I will admit, I feel like a huge geek in it.  But- it's worth it to protect my eyes.  I have  been surfing many years and resisting hats this whole time, but I'm at the point where the sun is just painful on my eyeballs; this hat makes it tolerable.  It is a little large on my head but you can cinch it tight enough that it works.  My hat circumference is 53cm and I purchased a S.","NOT_EMPLOYEE","2017-07-21 00:00:00","I've used it several times",""
"Outdoor Research","Solar Roller Sun Hat - Women's","105791880",5,"I have a relative large head for a pretty petite figure. I was really worried that the hat wouldn't fit! I did a rough measurement with a tape measure and the size M is perfect! If in-between sizes, going up a size might be a good idea because the drawcord can adjust the fit quite nicely. 

I got the blue one, it is just as vibrant as the picture! ","NOT_EMPLOYEE","2016-05-25 00:00:00","",""
"Outdoor Research","Solar Roller Sun Hat - Women's","105625703",3,"Great colors, nice shape, well made, but leaves a ridge mark on the forehead. Not as complete a design as the Seattle Sombrero which is becoming harder to find in choice colors. I tend not to wear mine because of the immediate ridge on my forehead, darn. Otherwise, looks and acts nice in the weather. Hope the Seattle Sombrero comes back, or this gets remade to include inside head band.","NOT_EMPLOYEE","2014-12-31 00:00:00","I've used it several times",""
"Outdoor Research","Solar Roller Sun Hat - Women's","5563246",5,"Exactly what i was looking for in a light weight, quick dry, roll-up and stuff, keeps-its-shape, backpacking hat. The only two flaws: 1) I had to remove a plastic bit on the size adjustment that was bouncing on the hat brim making an odd sound when I was hiking, and 2) in windy conditions, the brim blows up easily, exposing skin to the sun.  That's to be expected with such a light weight hat, however.  ","NOT_EMPLOYEE","2014-02-12 00:00:00","I've used it several times",""
"Outdoor Research","Solar Roller Sun Hat - Women's","1031164742",5,"Perfect hat for walks and hikes, sunny day or otherwise. Have been looking for a hat that was reasonably priced, cool fabric, and would stay on in the wind.  Found it! The fact that it has an adjustable headband and it's UPF 30 rated is a bonus.  Gift from my thoughtful husband.","NOT_EMPLOYEE","2013-08-03 00:00:00","I've used it several times",""
"Outdoor Research","Solar Roller Sun Hat - Women's","913075894",5,"I received my hat with much joy.  I took it with me to a water park, and while I was completely drenched, the hat was thoroughly dry!  It shielded me greatly from the harmful rays of the sun.  I wore it strapped to my head through many roller coasters; and, while other's hats flew off, mine stayed on.  The beautiful green color matches the envious faces of on-lookers.  I'm hoping that this fashionable hat will attract many young suitors, that I may one day wed.  Thank you, hat people!","NOT_EMPLOYEE","2013-07-21 00:00:00","I've used it several times",""
"Outdoor Research","Solar Roller Sun Hat - Women's","3771853","","If you're not careful, long days outside hiking, paddling or climbing can leave your skin damaged and burned. To keep you protected from damaging ultraviolet rays, Outdoor Research offers a full line of sun hats, and UV Protective shirts and pants designed to keep you protected from the sun.
","VENDOR_REP","2013-05-20 00:00:00","",""
"Outdoor Research","Sherman Jacket - Men's","109152519",5,"This is a great fleece insulated flannel from Outdoor Research.  One of the more comfortable long sleeve shirts I have owned.  This has been ideal for Fall in the Wasatch.  Fits well, I bought a large because odds are I will layer and prefer a looser fitting flannel.  This will probably make multiple appearances on the chairlift and at the camp fire over the winter.  Functional enough to take out on the trail and stylish enough to wear out on the weekend.  This is a winner from OR!  ","EMPLOYEE","2017-09-28 00:00:00","I've used it several times","true"
"Outdoor Research","Sherman Jacket - Men's","1321916124",5,"I love this thing, i use it riding on a motorcycle and as a layering piece. Its definitely toasty! 

Im 6'1'' and 170, i ended up going with a Med, although the arms are a hair short... I wanted something to just wear over a T-shirt. Size up to layer. Easily one of my favorite pieces of clothing. ","EMPLOYEE","2017-05-09 00:00:00","I've put it through the wringer","true"
"Outdoor Research","Sherman Jacket - Men's","1129683243",5,"This is the jacket that I've used most over the last 6 months. The high-pile fleece on the inside is easily the most comfortable material of any of the clothing that I own. So needless to say, I try to make any excuse that I can to wear it. It has great style and warmth! I'm 5'11' and 200 lbs and the size large fits me perfectly. ","EMPLOYEE","2017-02-16 00:00:00","I've put it through the wringer","true"
"Outdoor Research","Sherman Jacket - Men's","106819025",5,"I love this shacket. I wear it a good amount for going out after work or general usage as a daily wear. I do agree with the other review stating that it should be ordered a size up if you plan on layering underneath. In my true size it serves for my warmth without much else fitting under it.","NOT_EMPLOYEE","2016-12-23 00:00:00","I've put it through the wringer",""
"Outdoor Research","Sherman Jacket - Men's","106758410",5,"My new favorite shacket for sure. I'm 6'1"" 210lb with a 43inch chest which based on the size chart had me right on the edge of Large and Extra Large.   I went with the Extra Large and I'm glad I did.  I feel like sizing runs a little small so if you want to layer up then size up for sure.","NOT_EMPLOYEE","2016-11-23 00:00:00","",""
"Outdoor Research","Floodlight Down Jacket - Men's","110263463",5,"One very windy day I was very cold in my not-windproof 800 wt. down jacket which I intended to take on a high altitude trip to Japan.  Because of that shock I now own and have positively tested the OR Floodlight jacket (in pewter).  I cannot feel the icy blasts anywhere covered by this great jacket!  My only problem now is finding a stuff sack to pack it for the flight.  Can you recommend the correct size and brand for this purpose?","NOT_EMPLOYEE","2017-12-13 00:00:00","I've used it once or twice and have initial impressions",""
"Outdoor Research","Floodlight Down Jacket - Men's","4617752",5,"You'll undoubtedly face the same dilemma we all end up in...a dozen or more tabs open in your browser, debating the ethics of down fill, shopping for the perfect jacket. Tough break: there's no such thing...However, the Floodlight comes close if you're looking to spend time in Iceland in the spring, or want to look climber-chic hanging out in Camp 4 in January. Not too bulky, not so thin that it falls apart.

I'm slim, 5'11"", 155lbs, single digit body fat. I get cold VERY easily, especially if I'm just standing around taking photos, or casually walking around Reykjavik. That said, with a long sleeve compression top, $10 Costco fleece, and this jacket in size SMALL, I was perfectly warm in Iceland, despite winds strong enough to rip the doors off a rental car, and rain that will leave welts on unprotected skin, (15F ambient, 40-60mph winds). I bought a SMALL and it fits just about perfectly; just enough room for layering underneath. Have also used it while skiing in slushy wet conditions at only 8,000', and the jacket held up great. It's waterproof to the point that it's not going to let you get wet in anything less than a full day in a car wash. That said, if you're going to wear a backpack a lot, consider wearing a Frog Togs rain shell on the outside to avoid abrading the Pertex shell.

To be clear, I have the 1st gen version of this. I understand OR skinned it with better Pertex, added more down fill, and some stretch panels in the pits for the 2nd gen version. I'd love to upgrade, but I have a feeling mine will never wear out, so I'm taking it with me on the PCT in 2018! (Unless OR wants to gift me the newest version in Pewter/Lemongrass ;)","NOT_EMPLOYEE","2017-12-11 00:00:00","I've put it through the wringer",""
"Outdoor Research","Floodlight Down Jacket - Men's","109404505",4,"6' 2"", 180 lbs...large is slightly...large.  I most likely could have gotten away with medium - the sleeves are slightly long and the body is slightly large.  But, that makes for a great outer jacket that I can layer a lighter down jacket and thermals under.  With a mid-weight fleece, it works well down to 0 deg F just walking around.  I live in Fairbanks, AK and with this jacket, layered with a Basin & Range Wasatch 800 down jacket, I'm good down to -30 with only a t-shirt underneath.","NOT_EMPLOYEE","2017-10-21 00:00:00","",""
"Outdoor Research","Floodlight Down Jacket - Men's","745645859",4,"46L jacket, 38"" waist, 59 Yr Old Dad build.  Wanted this the moment I tried it on at local outfitter. Great warmth, great features, great weight and materials. Love, love, love the hood.  Problem for me is it's too  narrow at the bottom. Not its problem. It's literally all me.  Consequently, it rides up or pulls zipper apart.  Have to return for shorter style. Sad to see it go. ","NOT_EMPLOYEE","2017-03-04 00:00:00","I've used it several times",""
"Outdoor Research","Floodlight Down Jacket - Men's","4362225",4,"I've worn this jacket with just a baselayer and this thing is definitely wind/waterproof.  It's also very warm and sturdy.  wind gusts was around 20mph (the snowstorm in the boston yesterday) and this thing held up...  very impressed.  I was going to return it because it is built for slim people, besides that quality/performance is excellent.  5'11"" 34 waist, 41 chest, 190lb ...medium fit perfectly but snug around midsection..","NOT_EMPLOYEE","2017-02-10 00:00:00","I've used it several times",""
"Outdoor Research","Floodlight Down Jacket - Men's","108452195",4,"Its light, really warm and looks great if you get the right size. Pertex shield works well to repel rain. pockets are super warm. 
Problems lie with the sizing... make sure you size down 1 size. if you dont you'll be drowning in this coat. Also the dual zipper has been malfunctioning and i will be warrantying this with outdoor research who is always awesome about owning their defects. ","EMPLOYEE","2017-02-03 00:00:00","I've put it through the wringer","true"
"Outdoor Research","Floodlight Down Jacket - Men's","1129683243",5,"This jacket provides a great combination of warmth, light weight, and waterproofing. This is truly a bomber piece! I like the wire brim on the hood, which does a great job keeping the rain off of your face and from pooling on the jacket. It can get a little hot on warmer ski days without pit zips, but you can pretty much use this jacket on all days except for the warmest of spring days. The size large is a little tight around my midsection, but this jacket is so nice that it's great incentive to lose a couple LB's. ","EMPLOYEE","2017-01-26 00:00:00","I've used it several times","true"
"Outdoor Research","Floodlight Down Jacket - Men's","109137731",5,"I love this jacket.  It's my go to jacket for everyday use and winter activities.  It's super lightweight and compress-able without compromising quality.  I use smash this jacket into my backcountry skiing pack and use it often for ice climbing.  The comfort of the hood to be able to fit over a helmet and face coverage is wonderful and spacious.  I'll keep this jacket for a long time.  ","EMPLOYEE","2017-01-17 00:00:00","I've used it several times","true"
"Outdoor Research","Floodlight Down Jacket - Men's","1373833218",5,"Everything about this jacket is on point, it's super toasty wam, has a shell material (pertex shield) that cuts the wind and can keep you dry,  super nice fleece lined pockets, and so far it seems to be very  durable compared to some other down jackets I've worn.  I typically wear a size large when it comes to shirts and jackets but a I fit into a Medium for this particular item, but I agree with the comment bellow, it is a little tight in the armpits/shoulders which could make layering up a bit uncomfortable. ","EMPLOYEE","2017-01-07 00:00:00","I've used it once or twice and have initial impressions","true"
"Outdoor Research","Floodlight Down Jacket - Men's","997807",4,"I really wanted this jacket to work . I am 6 ft 210 linebacker type build and longer arms. The coat  is cut tightly in the arm pit area and runs on the large side. I tried an xl on and the sleeves and jacket were really long. I ended up buying the large and everything fit well except the pit area which pinched slightly and bugged me with a thin layer and would not be doable at all with anything thicker. I have other OR down jackets that are not cut this way. Really bummed as I have to return it and I hate returning things.","NOT_EMPLOYEE","2016-12-20 00:00:00","",""
"Outdoor Research","Floodlight Down Jacket - Men's","3113064",5,"My size: 5' 11'' 175 . 
Activities: Climbing, Hiking.
Live in: Jackson, WY
 I ordered a Large, but it was TOO big.  The Medium fit me perfect.  The jacket ends at my waist, so I can see my climbing gear.

I have worn the jacket in the rain at 37 F and the pertex shell worked perfect. A 30 MPH wind and 0 F I felt warm and never felt the wind. I stayed warm and dry.  The jacket is warm at 0 F as well.  The hood fits very well and the draw cord warps around your head for a very good fit.  It is easy to see and move in with the hood pulled up.","NOT_EMPLOYEE","2016-03-15 00:00:00","I've used it several times",""
"Outdoor Research","Floodlight Down Jacket - Men's","106640834",5,"I got this jacket for my boyfriend at the beginning of a cold Utah winter, and 2 months later, it is still all he can talk about! This jacket has been amazing, from riding his bike to the university, to hiking and climbing in the freezing temps, this jacket will keep you warm in any conditions. It is extremely lightweight, and extremely warm. It is water proof with taped seals, which helps protect you in all weather conditions. The pockets are higher on this jacket, which makes it really comfortable for hiking. Overall, its the best winter jacket he's ever had. 

It was a little roomier than he expected, so you may want to size down if you're looking for a more fitted jacket, but has has loved having the room to layer underneath! ","NOT_EMPLOYEE","2016-01-02 00:00:00","I've used it several times",""
"Outdoor Research","Floodlight Down Jacket - Men's","4420188",5,"I'm tall and lanky and the large fit perfectly. Was able to try it on before purchasing and the medium was a bit small. The jacket is SUPER warm and love that it is waterproof since i live in the NW. Very light weight which is nice for touring and wearing at the top of the mountain when the wind picks up. Can wear this jacket around town too with just a t-shirt underneath and feels great. Highly recommend this jacket if your going to buy a down.","NOT_EMPLOYEE","2015-11-10 00:00:00","I've used it several times",""
"Outdoor Research","Floodlight Down Jacket - Men's","3147913",5,"When i first got the jacket it didn't seem to have that much loft and I was a bit concerned of staying warm with it.  The pretax fabric adds a lot of warmth to the jacket.  I recently used the Floodlight jacket on a trip to Patagonia while climbing Cerro FitzRoy.  This jacket was part of my bivy system while on route.  The shell material kept me warm when it was windy and shredded the mixed snow/hail we had.  I would be aware it runs a bit big.  I'm 6'1"" 170lbs with a long torso.  I have a size large it if fits me good over all my layers while climbing.   
I also climbed several pitches up high with this jacket on and i'm surprised it didn't rip at all and looks still good.  

I have also used this jacket on stormy days for ski touring in the Wasatch.   

Overall pretty stoked on this jacket and would recommend it!","NOT_EMPLOYEE","2015-02-10 00:00:00","I've put it through the wringer",""
"Outdoor Research","Floodlight Down Jacket - Men's","2344864",3,"I just got this jacket. I've only used it briefly but I figured I'd give my initial thoughts.

I'm 5.9"", 185. I am sometimes between a medium and a large although most of my jackets are large.

Firstly, the fit for this jacket is listed as trim but I found the large to be very large on me. I think a medium might have worked better although I'll keep the large so that I can layer more underneath. This is not a thick puffy. Others say this runs small so clearly your mileage may vary, but I have a couple of OR base layer shirts and those too run really large. I've found their button-down shirts to be the same.

Secondly, the fabric is Pertex Shield+. I suspected that would mean a very shiny jacket and it is. I got mine in Hydro/Abyss (blue) and from many pictures you see online it doesn't look shiny at all. I'm OK with it, just FYI.

Thirdly, the Pertex fabric is a little ""crinkly"". Not as loud as some Gore-Tex jackets but definitely not silent like a Patagonia Down Sweater. It's not a big deal.

The key feature of this jacket is that it's waterproof (as the industry calls it) by having the Pertex Shield fabric and NOT puncturing it. There are no stitches through the fabric for the baffles.","NOT_EMPLOYEE","2015-01-25 00:00:00","I've used it once or twice and have initial impressions",""
"Outdoor Research","Floodlight Down Jacket - Men's","5586356",5,"I have worn it for 8 plus hours in dumping wet snow 32 degrees and when it was barely getting out of th single digits and 10 to 15 mph winds.  This puffy is water and wind proof, the only things most  puffy s have going against them.  My favorite use is hitting th e skin track with the floodlight on while it is storming.  I last longer than I think I would before taking it off it breaths well and then I will have a very light water proof shell underneath never exposing my base layers to the storm. Up top I s brush as much moisture as I can off and put the floodlight back on keeping the storm out and the heat in.    This coat is pretty perfect I have have my wife and sister in law use it and they were as highly impressed. A Norma puffy and nice shell would run me more so it ended up being a good value ","NOT_EMPLOYEE","2013-12-06 00:00:00","I've put it through the wringer",""
"Outdoor Research","Floodlight Down Jacket - Men's","100246870",4,"I live in South Dakota and wanted a jacket to wear when my Absolute Zero was too much. I was after that zero (F) to +40 range.  Waterproof would be nice as we get freezing rain too.  The jacket is very thin, like an inch thick. I was wanting more bulk when I had ordered. I first wore Floodlight with a short sleeve shirt under it on a windy +30F day, and it wasn't enough.  What I learned was this is a great jacket for layering. With a fleece sweater under it, it's warm down to nearly zero if there isn't a lot of wind.  I haven't had a chance to test waterproofness, but it looks like it will be OK in freezing rain but maybe not a down pour.  The zipper is pretty exposed. The hood is very nice, and the large pockets are outstanding.  It's a slim cut and fits a bit tight. At first I was disappointed with it, but the more I wore it the more I came to appreciate it, especially with a warm base layer.  It's lightweight and works for me.  I give it four stars because in high wind at 22F degrees, it doesn't hold heat quite as well as I wanted.  Excellent for layering, very well designed.  I am an avid winter outdoorsman and experienced hunter.  My winter hobby is taking photos during Dakota blizzards.  


Kent in SD","NOT_EMPLOYEE","2013-11-29 00:00:00","I've put it through the wringer",""
"Outdoor Research","Floodlight Down Jacket - Men's","1208293200",5,"I'm 6 tall and 160 lbs and the M size fit me very well . I know this jacket in March and it became my winter's choice immediately . It's 800 down insulated , soft , not ultralight , I don't like the ultralight down jacket at all , they are not warm . And the more important thing is it's water proof !","NOT_EMPLOYEE","2013-11-05 00:00:00","",""
"Outdoor Research","StormTracker Sensor Glove - Men's","110131126",4,"Crisp commute to work? Bone-chilling belays in the shade? Dry days shredding down the mountain? This glove will handle them all. Expect excellent dexterity and protection from the elements on all but the nastiest of days. 

The fleece tricot lining adds a decent amount of warmth on its own, but I suggest pairing with a thin wool liner to maximize warmth and performance. 

Pro tip: Extend the life of the leather palms by treating them with Nikwax Leather Conditioner (NIK0031)","EMPLOYEE","2017-11-11 00:00:00","I've put it through the wringer","true"
"Outdoor Research","StormTracker Sensor Glove - Men's","108442279",5,"Solid glove for spring mountaineering and ice climbing at your limit!","NOT_EMPLOYEE","2017-08-11 00:00:00","I've put it through the wringer",""
"Outdoor Research","StormTracker Sensor Glove - Men's","498374",5,"After using a pair on the slopes and around the village for a week in warmish (spring ski) temps I came to buy a second pair that won't live in my ski bag the rest of the winter.

Agree completely with the other reviews at the time of writing, these are stellar gloves for mildly cold days. Finding gloves that provide dexterity is challenging and these exceeded my expectations on that front (and I'm picky). The touch device support works reasonably well (for a glove). And they are incredibly comfortable from the liner to the supple leather.","NOT_EMPLOYEE","2017-03-29 00:00:00","I've used it several times",""
"Outdoor Research","StormTracker Sensor Glove - Men's","109289999",5,"These gloves are dope AF.  I bought them for a march ski trip to Aspen. Conditions were pretty benign, but the look and fit great and kept me warm, dry, and comfy.  They are not bulky so had plenty of dexterity for ski boots, phone, etc.  Radical!","NOT_EMPLOYEE","2017-03-29 00:00:00","I've used it once or twice and have initial impressions",""
"Outdoor Research","StormTracker Sensor Glove - Men's","107860133",5,"Excellent glove and warm enough for all conditions other than very cold. Probably good to as low as 0 C or -5C. Very comfortable. Sizing is standard and works well with operating a phone/touch screen device. Definitely recommend as a city glove or for skiing when not frigid. ","NOT_EMPLOYEE","2017-02-23 00:00:00","I've put it through the wringer",""
"Outdoor Research","StormTracker Sensor Glove - Men's","108605050",5,"This is the best sleek glove out there. It keeps me warm to the high 30's while being active. I've been searching for a light weight glove that keeps me warm while not sacrifciing dexterity and this is easily the best I have found. It's a do it all glove for me, from walking the dog, to skiing, to driving. I bring them everywhere! Look no further if you're looking for that light weight, good looking glove.

I'm 165 lbs and 5'10"" and I'm a medium all around. A medium fits me perfect in OR. Black Diamond gloves run a bit tight in a medium for me, just for reference. ","EMPLOYEE","2017-02-11 00:00:00","","true"
"Outdoor Research","StormTracker Sensor Glove - Men's","4165833",5,"I love the dexterity of these gloves. I use them primarily for ski touring, and ice climbing. Thus far the palm has worn well through rappeling, and the index fingers are intact after countless applications of my climbing skins to my skis. Highly recommend.

Fits true to size.","EMPLOYEE","2017-01-19 00:00:00","I've put it through the wringer","true"
"Outdoor Research","Peruvian Fleece Hat","107751852",5,"This hat is surprisingly warm for how light it is. It really does stop the wind very well. The drawstring is great for holding the ear flaps down when the wind blows. The material is soft and comfortable. I've had the hat for two months and it still looks like new.","NOT_EMPLOYEE","2017-04-01 00:00:00","I've used it several times",""
"Outdoor Research","Peruvian Fleece Hat","659320050",5,"I used this extensively on a winter (70 mile) hike thru the GSMNP in February. You barely notice it - very thin, lightweight and comfortable. If warmer, you can fold the earflap part up with the chinstrap on top of your head;  if really warm, the strap allows you to hang it off the back of your neck in front of your pack. For single digit temps in windy conditions, I used a buff below, a fleece cap over it and my windbreaker's hood cinched down, and was still toasty at a wind chill way below zero.  Packs small as well; I kept it in a small chest pack attached to the main backpack, along with snacks, water and emergency gear.","NOT_EMPLOYEE","2013-03-22 00:00:00","",""
"Outdoor Research","Peruvian Fleece Hat","4926552",5,"Love this hat for under my climbing helmet in the winter. I have a really large hat size, so it's a bit tight , but that allows me to fit it under my helmet without a lot of extra bulk. Keeps the wind out and my head warm. The ear flaps are nice, and can be tucked up when you don't need them. Doesn't pill up either. Full disclosure, I've been part of the Gore MountainTechs program since 2007, but I picked this hat up on my own. ","NOT_EMPLOYEE","2012-10-17 00:00:00","I've put it through the wringer",""
