"Outdoor Research","Transcendent Beanie","108634998",2,"I bought a L/XL based off of the size chart. Unfortunately it's ginormous. The fabric all bunches in the back leaving a layer effect. It almost resembles a turbin, thats how much fabric im talking here.  I wrote OR and am awaiting response.  Hat is warm enough and will be taking on backwoods outing in a few days. ","NOT_EMPLOYEE","2016-12-12 00:00:00","I've used it several times",""
"Outdoor Research","Transcendent Beanie","108320272",5,"Very light weight, comfortable and warm as can be. I even wear it when I sleep outside and don't even notice it.","NOT_EMPLOYEE","2016-12-11 00:00:00","I've used it several times",""
"Outdoor Research","Transcendent Beanie","3120772",5,"this hat is amazing, it looks good on and folds up small enough to fit in your pocket.  it is so incredibly warm, i'm so glad i bought it!","NOT_EMPLOYEE","2015-02-06 00:00:00","",""
"Outdoor Research","Transcendent Beanie","4196192",5,"I bought this product for my wife since she is naturally cold blooded.  It is now her favorite dog walking hat for 0 - 30 degree weather.  She also brings it on all back country expeditions for guaranteed warmth when ever she needs it. ","NOT_EMPLOYEE","2013-01-16 00:00:00","I gave it as a gift but have feedback to share",""
"Outdoor Research","Transcendent Beanie","1849786",5,"look no farther for the warmest beanie. this is a must beanie.... I can even wear this in the sleeping bag without readjusting it .stays put.
well worth it ! ","NOT_EMPLOYEE","2013-01-10 00:00:00","I've used it once or twice and have initial impressions",""
"Outdoor Research","Transcendent Beanie","4398144",5,"Blocks wind and extremely warm in the coldest temperatures. A must for anyone who lives in the extreme cold.  ","NOT_EMPLOYEE","2012-10-23 00:00:00","",""
"Outdoor Research","Transcendent Beanie","609310056",5,"i love my down beanie its very warm and it packs down so small !  i got a big nugget so i had to get a lg xlg and it fits well i have a 7 3/8 in head ","NOT_EMPLOYEE","2012-10-10 00:00:00","I've put it through the wringer",""
"Outdoor Research","Transcendent Beanie","3480497",5,"I got this just to keep my head warm when stopping on the winter trail for a break and of around base camp on climbs.  Well worth the money! Incredibly warm of course and very soft.  Not as breathable as I would like, but you can't have everything you want.  ","NOT_EMPLOYEE","2012-09-19 00:00:00","",""
"Outdoor Research","Sonata Ultra Hooded Down Jacket - Women's","108362308",5,"I am ALWAYS cold. This jacket is so puffy and warm that I can actually stay comfortable. Its also super stylish and Ive received many compliments on it. Super excited for the winter ahead now!","NOT_EMPLOYEE","2017-11-27 00:00:00","",""
"Outdoor Research","Sonata Ultra Hooded Down Jacket - Women's","108558345",5,"I've had this jacket for quite a while now and it has been amazing for cold nights in the desert, as a belay jacket, and everything in between! So I was very sad when I had an accident and ruined it... until Outdoor Research impressed me once again. Not a problem - a new one is on the on the way! Their Infinite Guarantee is killer - you probably won't need it because the quality is great but definitely nice to know! 

My favorite thing about this jacket is how roomy it feels while still being a slimmer fit for a puffy. So good. ","EMPLOYEE","2017-11-14 00:00:00","I've put it through the wringer","true"
"Outdoor Research","Sonata Ultra Hooded Down Jacket - Women's","108558345",5,"I got this jacket as another layer for camping, and just liked how light it felt. And as I've use it more, it now is always stuffed into my climbing bag, day pack, or car if there is any chance of it getting chilly. Weighing in under a pound, it's super easy to bring along!

As with all puffy jackets, it is not form fitting. I have the blue in a size small and it fits well over any layers, and I love the color! Another plus is the fleece lined pockets! 

If you have any specific questions about this jacket, or are trying to decide which puffy is best for you, I'd be happy to help out! Just shoot me an email at mwarren@backcountry.com or a call at 801-523-4067.","EMPLOYEE","2017-05-14 00:00:00","I've put it through the wringer","true"
"Outdoor Research","Sonata Ultra Hooded Down Jacket - Women's","108551338",5,"This is the jacket I wish I had when I was trekking in Nepal. Much warmer than my Patagonia Down Sweater and equally as packable. The hood has a great pull cord to adjust over a helmet or to hold 'er down when  it's windy. I got the small and it fits with enough room to layer. The pocket on the upper chest is great for storing your phone while climbing with your harness on for easy access to your phone or a snack on cold days. I look forward to bringing this on backcountry splitboarding tours next winter! ","EMPLOYEE","2017-05-02 00:00:00","I've used it several times","true"
"Outdoor Research","Sonata Ultra Hooded Down Jacket - Women's","108551338","","If you have any questions on sizing, tech specs, or fit please reach out to me directly! As an account manager I'm here to give you personalized assistance and guidance on anything you might need from Backcountry. ","EMPLOYEE","2017-03-22 00:00:00","","true"
"Outdoor Research","Sonata Ultra Hooded Down Jacket - Women's","106565890",4,"I bought this jacket because I was going to France in January and the average weather temp was about 25F. I'm usually an avid arc'teryx fan, but after freezing in germany I decided to try OR. I ordered a medium and for the most part it fits true to size. I have much larger hips than my upper body and this jacket is fairly long so it's a little tight around my hip area. So ladies, if you have the same problem as i do, just be aware that its going to be a little snug on the bottom. This jacket, paired with a smartwool thermal, was perfect for keeping me comfortable despite the intense cold which is definitely saying something since I usually run pretty cold in general. Light weight, conveniently placed pockets, and the fact that it stuffs down is worth its weight in gold when you are packing light.  My biggest complaint is when I would take my jacket off at the end of the day I would be COVERED in down. Not a feather here or there, it was an unsettling amount, enough to make me wish i brought a lint roller along, ha! This jacket is fabulous and the warmest thing I own, but i'm wondering with the amount of down that sheds out of it how long it will stay that way? ","NOT_EMPLOYEE","2017-02-13 00:00:00","I've used it once or twice and have initial impressions",""
"Outdoor Research","Sonata Ultra Hooded Down Jacket - Women's","107576829",5,"This jacket is like wearing a cloud. It's so cozy I keep it on while I wait for the heat to kick in at the office Monday mornings. I also love how easy it is to pack into the left pocket, and how it can double as my travel pillow on the plane with the cozy fleece pocket lining! 

Also, sleeves are long, which I love being very tall and struggling to find a jacket with long enough sleeves :) ","NOT_EMPLOYEE","2016-12-28 00:00:00","I've used it several times",""
"Outdoor Research","Sonata Ultra Hooded Down Jacket - Women's","108500959",5,"Recently got this jacket, I've worn it a few times and love it. The sleeves are long and cover most of my hand which I love! It's warm, fits nice and is very comfortable. Very happy with my purchase!","NOT_EMPLOYEE","2016-11-24 00:00:00","I've used it several times",""
"Outdoor Research","Sonata Ultra Hooded Down Jacket - Women's","108500954",5,"I recently was on the market for a new puffy jacket, and was able to get this on a discount. At 6'1"" I have really long arms which usually makes it hard for me to find a jacket with long enough arms in the right body size. This jacket proved the opposite, the arms are long enough to cover half of my hand, and the body fits perfectly. Never thought I'd be able to say I'm completely in love with a jacket, and yet here I am.
Pros:
-800 fill down keeps me toasty on campus
-compacts easily to be attached to, or shoved into my 28 L book bags front pocket
-long arms!!! 
-body has a flattering shape with enough space to wear a hoodie or mid layer under it
Cons: none so far, but I'll update if I find any
Overall, this has become my go to jacket for the changing weather. The blue color is fun, and helps me stay more visible while crossing the street after dark. I would buy this jacket again at full price.","EMPLOYEE","2016-11-08 00:00:00","I've used it several times",""
"Outdoor Research","Foray Jacket - Men's","6278971",2,"I originally got this jacket two years ago. After a few months of moderate use, I noticed that it was wetting out quickly and letting water in through the sholders, so I contacted OR. They told me to wash it with Nikwax Techwash, which I did but that didn't help much. After this, they were nice enough to send me a new jacket under warranty. Great service!

Unfortunately, the second jacket fared the same. After only a few months of casual use, it would wet out at the shoulders completely. In about 10 minutes of moderate rain, my shoulders would be wet beneath the jacket! A year later, the problem has only gotten worse and now the entire jacket wets out quickly.

If you just want a jacket for casual use, get something cheaper like the Marmot Precip that will perform just as well. If you want a real hardshell, spend an extra $100 for something like the Arcteryx Beta LT (which now I own and love). Just don't waste your money on this one. I'm practically an OR model with how much OR gear I have, but this is the one item that has disappointed me from them.","NOT_EMPLOYEE","2017-11-26 00:00:00","I've put it through the wringer",""
"Outdoor Research","Foray Jacket - Men's","110199651",5,"I'm 5'10"" 150 lbs and I bought the large and it's a little big around the chest on me, but then again I should probably hit the gym. I don't mind the extra space since I use it as an outer layer and sometimes have a puffy on underneath. Sleeve and jacket length is perfect for me. Also the cinch cord on the waist and hood do a great job of keeping it tight.
I've mainly been using the Foray for splitboarding and storm days in bounds.  I've owned it a little over a year now and have been really stoked on its performance in both rain and snow.  It is so lightweight, and packable which is why I chose it for touring.  I actually just learned yesterday that it packs into the left hand pocket for easy storage in the pack!  Can't believe I went all last winter without knowing this!  Check out the picture.
 In some other reviews people have expressed disappointment with water bleeding through, and I believe that is due to the Gore-Tex membrane.  Over time the fibers don't repel water droplets that well, and they will bleed into the material like one reviewer's photo shows. The water won't actually permeate through the membrane, but it pulls heat off your body through the membrane and feels cold and gives you this unpleasant damp sensation.   I recently learned that to prevent this you need to wash the jacket and then tumble dry on low.  The drying is the critical part here.  Somehow it helps the fibers stand up again and reactivates the DWR.  This is true for all Gore-Tex outerwear!  Read about it here https://www.gore-tex.com/support/care/washing-instructions
I have been really happy with the Foray and OR in general.  With their infinite guarantee you know they will take care of you.","EMPLOYEE","2017-11-07 00:00:00","I've put it through the wringer","true"
"Outdoor Research","Foray Jacket - Men's","3289228",2,"I bought this jacket mainly for backpacking, a jacket in town and even occasionally work. I have had this coat for about a year. I never expect a jacket to be totally water proof if you're spending all day in the rain (except for serious shells where you are spending some $$). Definitely had some soak through faster than expected. Especially around pack straps, which is to be expected. Recently the ventilation zipper on the left side pulled off after getting warm on a hike leaving my whole left side exposed to the rain. I wouldn't consider myself aggressive with me gear so I'm not sure what happened....","NOT_EMPLOYEE","2017-11-01 00:00:00","I've put it through the wringer",""
"Outdoor Research","Foray Jacket - Men's","103989923",2,"Like, wow. $250 CAD for a jacket that can't take more than 30 minutes of rain is pretty absurd. I love that it fits well and doesn't look like I'm wearing a trash bag, but if it can't keep me dry in the mountains that's not much good is it? A few days into the mountains, that kind of failure can kill a person.

Gave it a second shot after returning one a year prior, nope, still major manufacturing defects present. Don't know what they're doing to the Gore-Tex but it's bad.","NOT_EMPLOYEE","2017-10-15 00:00:00","I've used it several times",""
"Outdoor Research","Foray Jacket - Men's","3345371",2,"I had two jackets. The first jacket's zipper didn't work and I exchanged it for another jacket of the same kind. The second jacket wasn't waterproof.

Overall, this jacket was comfortable and fit great, but it was not waterproof at all. The surface of the jacket had initial water resistance, but the water eventually soaked through the surface after about five minutes. 

Very disappointed with this jacket. ","NOT_EMPLOYEE","2017-06-16 00:00:00","I've used it once or twice and have initial impressions",""
"Outdoor Research","Foray Jacket - Men's","106552298",4,"If you're seeking a durable rain jacket with great ventilation, the Foray is the obvious choice. It will keep you dry through all kinds of pouring and blowing rain, and offers more ventilation than any other jacket. It is fantastically versatile; if you feel like you want the full-length ventilation zippers, save some weight and check out the Marmot Minimalist or Arc'teryx Beta SL.","EMPLOYEE","2017-05-30 00:00:00","I've used it once or twice and have initial impressions","true"
"Outdoor Research","Foray Jacket - Men's","107121970",2,"So I really really really wanted to like this jacket. I live in a sub-tropical area that demands a jacket that care really breathe AND keep the rain off.

I bought the first jacket. I finally got to test it one day on the way to work. From when I got out of my car and got to my desk, I spotted areas wetting out on my left arm. The rain wasn't even what I'd call a downpour, more of a drizzle.

I contacted OR about it, got a new one (just in time for a trip to the Olympic Coast). I was planning to backpack down the coast for 4 days...I had to cut it short by a day. It rained the whole first day...my new jacket wetted out...and got to my baselayer. I was wearing wool so it wasn't all too bad but I was disappointed with this failing gear. By the second night, I was under an emergency blanket while waiting for my baselayers (yes, plural) and jacket to dry out.

Talked to OR again (who are GREAT) and have come to an arrangement. I think OR is great, their design is great. This jacket seems to be an anomaly. Folks swear by their older Forays. But this one was just disappointing. Other reviews say it was a bad batch...but if you look at the dates of these reviews...they spread over a somewhat lengthy time span. Why have they not pulled all the ""bad batches"" yet?

Foray pants were great- but the jacket, again, the torsoFlow zippers and the lightweightedness of the jacket made it a real winner....but performance just didn't live up to the hype.It may be great for Seattle itself...not sure about the peninsula.","NOT_EMPLOYEE","2017-05-08 00:00:00","I've put it through the wringer",""
"Outdoor Research","Foray Jacket - Men's","108885161",5,"I have used this for two seasons as my winter shell layer and have loved it. It fits a little large allowing layers to go under. It has proved to be waterproof through snow as well as rain. ","EMPLOYEE","2017-01-03 00:00:00","I've put it through the wringer","true"
"Outdoor Research","Foray Jacket - Men's","4675122",3,"So this jacket has been great. It has kept me dry, as expected for the price. The zippers seem to be watertight, despite the lack of storm flaps. It breathes well also. 

Only one problem, it ""wets out"". I'm not sure if this is normal for goretex paclite. This is after a very light rain.... Hoping OR rep can provide insight... 

In response to the Leta's, an OR rep, response; This jacket has not been worn hard. Heck, it was only 3 days old when it performed the exact same way in AK. A brand new jacket should not need to have additional DWR applied. Also, this jacket has not been washed, or dried. I will be contacting OR directly :-(","NOT_EMPLOYEE","2016-12-27 00:00:00","I've used it several times",""
"Outdoor Research","Foray Jacket - Men's","4862528",5,"Love this jacket!  Great fit and simple styling.  Kept me dry in Iceland...and it was rather wet.  Took a couple tumbles and no tears or wear marks so it seems to be durable as well!  Always happy with OR products!","NOT_EMPLOYEE","2016-10-24 00:00:00","I've used it several times",""
"Outdoor Research","Foray Jacket - Men's","108380633",2,"I had high hopes for this jacket, but it just isn't very waterproof. It beads decently for 5-10 min in moderate rain, but then wets out very quickly. Additionally, moisture will get through in heavy rains if outside for an extended period of time.

Durability is also a concern. The high wear areas (shoulders, pockets, cuffs) lose their DWR repellency very quickly, after only a few uses. Nikwak somewhat restores them, but not well.

Only bright side is OR has great customer service. When they heard about my complaints, they sent me a new jacket. It has the same problems. At least I could sell that one to recover some of the money...","NOT_EMPLOYEE","2016-09-26 00:00:00","I've put it through the wringer",""
"Outdoor Research","Foray Jacket - Men's","106552293",4,"this jacket is awesome!!! I love the TorsoFlo of the jacket!! I usually break out into a sweat wearing jackets while adventuring but it was so nice to unzip the sides and get some air flow to the mid section.","NOT_EMPLOYEE","2016-07-06 00:00:00","I've used it several times",""
"Outdoor Research","Foray Jacket - Men's","2102844475",5,"I originally wanted the Axiom jacket, (ODR009B), but it was just out of my price range. However, the Foray is definitely the next best alternative. For 2 Layer Gore-tex, this jacket breathes and holds it's waterproofing well. The zippers on it are a little difficult to zip, though I guess that's expected with any jacket where the zippers are waterproof as well. The jacket also has plenty of room to layer with. If you're looking for an awesome gore-tex jacket without forking over an arm and a leg, the Foray is your best choice!","NOT_EMPLOYEE","2016-05-30 00:00:00","I've used it several times",""
"Outdoor Research","Foray Jacket - Men's","4992964",5,"I've owned this jacket going on five years now. I'm a fisheries biologist, and in that time I've been in warm summer thunderstorms, blizzards, hail, sideways deluges, and strolling through town in a light sprinkle. It's seen regular use in the Cascades and Coastal Ranges of Oregon and California, the both the Eastern and Western Sierra Nevadas, afternoon summer thunderstorms in the Midwest, and in various trips around the country: I rarely go outdoors for extended periods without it in my pack. In my experience, it has worked very well as an outer shell in a layering system (don't expect it to be warm by itself) in the cold and as a easily packable shell for the odd alpine thunderstorm in the summer. It's very breathable (as far as jackets go), incredibly lightweight, the side-zippers offer excellent ventilation, and it has been completely waterproof since I initially purchased it all those years ago. It has kept me as comfortable as I can reasonably expect it to in any situation where I need to wear it. It fits me very well, too, whether or not I am layering up. In my estimation, it has offered excellent performance at a great value. 

Admittedly, I haven't worn many other GoreTex rain jackets to compare it to. Those jackets that I have tried were polyurethane (or other) treated nylon, or equivalent: I could see those being fine for around the town, but they ultimately have a track record of failing with any sustained back country use. Since I've purchased this jacket, I haven't needed to try any others. Other folks I have met, wearing different brands of varying cost, have had jacket-envy.

The side-zippers, pockets and velcro (which I am most surprised by), have held up so far. That being said, the material is starting to fray, particularly the stitching towards the ends of the sleeves; it has picked up some grime and dirt from continued use, which has caused it to start ""wetting out,"" as mentioned in a previous review (it did bead water earlier in it's life, and, as he mentioned, it is still waterproof); and it has probably picked up a particularly fishy odor. None of these are problems that I think a person can reasonably expect to avoid (given how I've used it) with a different jacket.

Once I have to retire this jacket due to failure from regular wear-and-tear, I'll purchase another-- especially at its common sale price of $150.

Edit:

One additional thing worth mentioning that slipped my mind in the initial review is that the jacket does not seem particularly windproof.  Worn by itself on a boat or in heavy winds, wind can cut through pretty easily.

Also, Outdoor Research, please bring back the old Olive color.  It's a good 'un.  ""Hops"" ain't doing it for me.  None of the new colors really are.","NOT_EMPLOYEE","2016-03-29 00:00:00","I've put it through the wringer",""
"Outdoor Research","Foray Jacket - Men's","4188264",3,"Definitely not my go to jacket, but a jacket that does OK in the alpine. Has some suspect durability issues with the side zips. Has kept me dry so far this season. One of the most packable 4-season shells I have owned and has a reasonably durable outer fabric. 

Pros: Light, packable, sheds rain and snow well, a shell with side zips is hard to come by sometimes these days.

Cons: Weak hood, side zips blow out easy","NOT_EMPLOYEE","2016-03-16 00:00:00","",""
"Outdoor Research","Foray Jacket - Men's","107320070",4,"I got this Jacket hoping it could be versatile enough to wear snowboarding as a shell. With a couple of layers underneath it did the job and kept me dry on the North East slopes. 

It is worth noting that my pocket ripped and I had to exchange for another so I wouldn't say its bomb proof but if you don't abuse it, you can use it as a snowboard shell in addition to having a very good rain jacket for the other 3 seasons.

I have the hops color which I love and looks great in pictures.","NOT_EMPLOYEE","2016-03-11 00:00:00","I've used it several times",""
"Outdoor Research","Foray Jacket - Men's","106274770",5,"I got this jacket as an alternative to my lighter running shells for when I am doing extended hikes, winter snowshoeing and around camp over a down when there is rain or wind. First, I love the zippers. They are well sealed and never catch. It runs a tad large but fits perfectly over some base layers or warmer layers but I wouldn't use it for anything where I wanted to run or go fast. Perfect for hiking, slow skiing or winter ascents.","NOT_EMPLOYEE","2015-11-30 00:00:00","I've used it several times",""
"Outdoor Research","Foray Jacket - Men's","100340178",1,"Took this new jacket out for a 15 minute stroll in some fairly heavy rain. On return/exam, it appears the fabric may not have been treated consistently. Also doesn't seem to breath that well. I found myself getting sweaty just sitting at my desk with everything zipped up. Photo is of just one area inside the jacket, near the mid back, that soaked through, as I could only upload one. I was not wearing a pack. Fortunately, BC is covering return shipping on the exchange. :)","NOT_EMPLOYEE","2015-10-31 00:00:00","I've used it once or twice and have initial impressions",""
"Outdoor Research","Foray Jacket - Men's","5537853",4,"I bought the Foray to replace a Marmot Precip that leaked like a sieve.  I spent a week backpacking in Yosemite and with only one day of the trip left, I still had no need to pull the Foray out.  That changed the last day; we were expecting some light rain but got snow instead.  I threw the Foray on and was really impressed  on how well it kept me dry and with the great side vents I didn't get too hot either.  It did wet out a bit under my backpack straps, but nothing like the Precip did.  Over all I'm very pleased with the Foray.","NOT_EMPLOYEE","2015-10-19 00:00:00","I've used it once or twice and have initial impressions",""
"Outdoor Research","Foray Jacket - Men's","745961371",4,"I was looking for light Gore-Tex shell and couldn't pass on this jacket when it went on sale.  Initially I purchased the large thinking layering could make it more versatile; but the sleeves literally hung 6 inches past my fingers (and I am 6'2"").  Exchanged it for a medium.  The fit is better but still baggy.  I feel like I could easily fit into a small.   I kept the medium and took it up Mt. Humphrey's in October.  The jacket kept me warm in the cold high-altitude wind and packed great the rest of the trek.  Haven't had it heavy rain yet but so far happy with the purchase.  ","NOT_EMPLOYEE","2015-10-15 00:00:00","I've used it several times",""
"Outdoor Research","BioSensor Glove Liner - Men's","3244369",3,"I'm sure these are fine as a liner, but they tore and ripped within a few days of use while hiking. ","NOT_EMPLOYEE","2017-10-14 00:00:00","I've used it several times",""
